{
  "dependencies": [
    "@udecode/plate-dnd",
    "@udecode/plate-selection",
    "@udecode/plate-block-quote",
    "@udecode/plate-excalidraw",
    "@udecode/plate-heading",
    "@udecode/plate-layout",
    "@udecode/plate-table",
    "@udecode/plate-toggle",
    "@udecode/plate-media",
    "react-dnd",
    "react-dnd-html5-backend"
  ],
  "doc": {
    "description": "A drag handle for moving editor blocks.",
    "docs": [
      {
        "route": "/docs/dnd",
        "title": "Drag & Drop"
      },
      {
        "route": "https://pro.platejs.org/docs/components/draggable"
      }
    ],
    "examples": [
      "dnd-demo",
      "dnd-pro"
    ],
    "usage": [
      "import { DndPlugin } from '@udecode/plate-dnd';\nimport { NodeIdPlugin } from '@udecode/plate-node-id';\nimport { DndProvider } from 'react-dnd';\nimport { HTML5Backend } from 'react-dnd-html5-backend';",
      "export function MyEditor() {\n  const editor = usePlateEditor({\n    plugins: [\n      // ...otherPlugins,\n      NodeIdPlugin,\n      DndPlugin.configure({ options: { enableScroller: true } }),\n    ],\n    override: {\n      components: {\n        // ...components\n      },\n    }\n  });\n\n  return (\n    <DndProvider backend={HTML5Backend}>\n      <Plate editor={editor}>\n        <PlateContent />\n      </Plate>\n    </DndProvider>\n  );\n}"
    ]
  },
  "files": [
    {
      "path": "plate-ui/draggable.tsx",
      "content": "'use client';\n\nimport React, { useMemo } from 'react';\n\nimport { cn, withRef } from '@udecode/cn';\nimport { isType } from '@udecode/plate';\nimport { BlockquotePlugin } from '@udecode/plate-block-quote/react';\nimport { CodeBlockPlugin } from '@udecode/plate-code-block/react';\nimport { useDraggable, useDropLine } from '@udecode/plate-dnd';\nimport { ExcalidrawPlugin } from '@udecode/plate-excalidraw/react';\nimport { HEADING_KEYS } from '@udecode/plate-heading';\nimport { ColumnItemPlugin, ColumnPlugin } from '@udecode/plate-layout/react';\nimport {\n  ImagePlugin,\n  MediaEmbedPlugin,\n  PlaceholderPlugin,\n} from '@udecode/plate-media/react';\nimport { BlockSelectionPlugin } from '@udecode/plate-selection/react';\nimport {\n  TableCellPlugin,\n  TablePlugin,\n  TableRowPlugin,\n} from '@udecode/plate-table/react';\nimport { TogglePlugin } from '@udecode/plate-toggle/react';\nimport {\n  type PlateRenderElementProps,\n  type RenderNodeWrapper,\n  MemoizedChildren,\n  ParagraphPlugin,\n  useEditorRef,\n  useElement,\n  usePath,\n  usePluginOption,\n} from '@udecode/plate/react';\nimport { useReadOnly, useSelected } from '@udecode/plate/react';\nimport { GripVertical } from 'lucide-react';\n\nimport { STRUCTURAL_TYPES } from '@/components/editor/transforms';\n\nimport { TooltipButton } from './tooltip';\n\nconst UNDRAGGABLE_KEYS = [\n  ColumnItemPlugin.key,\n  TableRowPlugin.key,\n  TableCellPlugin.key,\n];\n\nexport const DraggableAboveNodes: RenderNodeWrapper = (props) => {\n  const { editor, element, path } = props;\n  const readOnly = useReadOnly();\n\n  const enabled = useMemo(() => {\n    if (readOnly) return false;\n    if (path.length === 1 && !isType(editor, element, UNDRAGGABLE_KEYS)) {\n      return true;\n    }\n    if (path.length === 3 && !isType(editor, element, UNDRAGGABLE_KEYS)) {\n      const block = editor.api.some({\n        at: path,\n        match: {\n          type: editor.getType(ColumnPlugin),\n        },\n      });\n\n      if (block) {\n        return true;\n      }\n    }\n    if (path.length === 4 && !isType(editor, element, UNDRAGGABLE_KEYS)) {\n      const block = editor.api.some({\n        at: path,\n        match: {\n          type: editor.getType(TablePlugin),\n        },\n      });\n\n      if (block) {\n        return true;\n      }\n    }\n\n    return false;\n  }, [editor, element, path, readOnly]);\n\n  if (!enabled) return;\n\n  return (props) => <Draggable {...props} />;\n};\n\nexport const Draggable = withRef<'div', PlateRenderElementProps>(\n  ({ className, ...props }, ref) => {\n    const { children, editor, element, path } = props;\n    const blockSelectionApi =\n      editor.getApi(BlockSelectionPlugin).blockSelection;\n    const { isDragging, previewRef, handleRef } = useDraggable({\n      element,\n      onDropHandler: (_, { dragItem }) => {\n        const id = (dragItem as any).id;\n\n        if (blockSelectionApi && id) {\n          blockSelectionApi.set(id);\n        }\n      },\n    });\n\n    const isInColumn = path.length === 3;\n    const isInTable = path.length === 4;\n\n    return (\n      <div\n        ref={ref}\n        className={cn(\n          'relative',\n          isDragging && 'opacity-50',\n          STRUCTURAL_TYPES.includes(element.type) ? 'group/structural' : 'group'\n        )}\n      >\n        {!isInTable && (\n          <Gutter>\n            <div\n              className={cn(\n                'slate-blockToolbarWrapper',\n                'flex h-[1.5em]',\n                isType(editor, element, [\n                  HEADING_KEYS.h1,\n                  HEADING_KEYS.h2,\n                  HEADING_KEYS.h3,\n                  HEADING_KEYS.h4,\n                  HEADING_KEYS.h5,\n                ]) && 'h-[1.3em]',\n                isInColumn && 'h-4'\n              )}\n            >\n              <div\n                className={cn(\n                  'slate-blockToolbar',\n                  'pointer-events-auto mr-1 flex items-center',\n                  isInColumn && 'mr-1.5'\n                )}\n              >\n                <div ref={handleRef} className=\"size-4\">\n                  <DragHandle />\n                </div>\n              </div>\n            </div>\n          </Gutter>\n        )}\n\n        <div ref={previewRef} className=\"slate-blockWrapper\">\n          <MemoizedChildren>{children}</MemoizedChildren>\n\n          <DropLine />\n        </div>\n      </div>\n    );\n  }\n);\n\nconst Gutter = React.forwardRef<\n  HTMLDivElement,\n  React.HTMLAttributes<HTMLDivElement>\n>(({ children, className, ...props }, ref) => {\n  const editor = useEditorRef();\n  const element = useElement();\n  const path = usePath();\n  const isSelectionAreaVisible = usePluginOption(\n    BlockSelectionPlugin,\n    'isSelectionAreaVisible'\n  );\n  const selected = useSelected();\n\n  const isNodeType = (keys: string[] | string) => isType(editor, element, keys);\n\n  const isInColumn = path.length === 3;\n\n  return (\n    <div\n      ref={ref}\n      className={cn(\n        'slate-gutterLeft',\n        'absolute -top-px z-50 flex h-full -translate-x-full cursor-text hover:opacity-100 sm:opacity-0',\n        STRUCTURAL_TYPES.includes(element.type)\n          ? 'group-hover/structural:opacity-100'\n          : 'group-hover:opacity-100',\n        isSelectionAreaVisible && 'hidden',\n        !selected && 'opacity-0',\n        isNodeType(HEADING_KEYS.h1) && 'pb-1 text-[1.875em]',\n        isNodeType(HEADING_KEYS.h2) && 'pb-1 text-[1.5em]',\n        isNodeType(HEADING_KEYS.h3) && 'pt-[2px] pb-1 text-[1.25em]',\n        isNodeType([HEADING_KEYS.h4, HEADING_KEYS.h5]) &&\n          'pt-[3px] pb-0 text-[1.1em]',\n        isNodeType(HEADING_KEYS.h6) && 'pb-0',\n        isNodeType(ParagraphPlugin.key) && 'pt-[3px] pb-0',\n        isNodeType(['ul', 'ol']) && 'pb-0',\n        isNodeType(BlockquotePlugin.key) && 'pb-0',\n        isNodeType(CodeBlockPlugin.key) && 'pt-6 pb-0',\n        isNodeType([\n          ImagePlugin.key,\n          MediaEmbedPlugin.key,\n          ExcalidrawPlugin.key,\n          TogglePlugin.key,\n          ColumnPlugin.key,\n        ]) && 'py-0',\n        isNodeType([PlaceholderPlugin.key, TablePlugin.key]) && 'pt-3 pb-0',\n        isInColumn && 'mt-2 h-4 pt-0',\n        className\n      )}\n      contentEditable={false}\n      {...props}\n    >\n      {children}\n    </div>\n  );\n});\n\nconst DragHandle = React.memo(() => {\n  const editor = useEditorRef();\n  const element = useElement();\n\n  return (\n    <TooltipButton\n      variant=\"ghost\"\n      className=\"h-6 w-4.5 p-0\"\n      onClick={() => {\n        editor\n          .getApi(BlockSelectionPlugin)\n          .blockSelection.set(element.id as string);\n      }}\n      data-plate-prevent-deselect\n      tooltip=\"Drag to move\"\n    >\n      <GripVertical className=\"text-muted-foreground\" />\n    </TooltipButton>\n  );\n});\n\nconst DropLine = React.memo(\n  React.forwardRef<HTMLDivElement, React.HTMLAttributes<HTMLDivElement>>(\n    ({ className, ...props }, ref) => {\n      const { dropLine } = useDropLine();\n\n      if (!dropLine) return null;\n\n      return (\n        <div\n          ref={ref}\n          {...props}\n          className={cn(\n            'slate-dropLine',\n            'absolute inset-x-0 h-0.5 opacity-100 transition-opacity',\n            'bg-brand/50',\n            dropLine === 'top' && '-top-px',\n            dropLine === 'bottom' && '-bottom-px',\n            className\n          )}\n        />\n      );\n    }\n  )\n);\n",
      "type": "registry:ui",
      "target": "components/plate-ui/draggable.tsx"
    }
  ],
  "name": "draggable",
  "registryDependencies": [
    "tooltip",
    "use-mounted"
  ],
  "type": "registry:ui",
  "$schema": "https://platejs.org/schema/registry-item.json",
  "author": "udecode (https://platejs.org)"
}