{
  "dependencies": [
    "@radix-ui/react-separator"
  ],
  "doc": {
    "description": "Visually or semantically separates content.",
    "links": {
      "doc": "https://ui.shadcn.com/docs/components/separator"
    }
  },
  "files": [
    {
      "path": "plate-ui/separator.tsx",
      "content": "'use client';\n\nimport * as SeparatorPrimitive from '@radix-ui/react-separator';\nimport { withProps, withVariants } from '@udecode/cn';\nimport { cva } from 'class-variance-authority';\n\nconst separatorVariants = cva('shrink-0 bg-border', {\n  defaultVariants: {\n    orientation: 'horizontal',\n  },\n  variants: {\n    orientation: {\n      horizontal: 'h-px w-full',\n      vertical: 'h-full w-px',\n    },\n  },\n});\n\nexport const Separator = withVariants(\n  withProps(SeparatorPrimitive.Root, {\n    decorative: true,\n    orientation: 'horizontal',\n  }),\n  separatorVariants\n);\n",
      "type": "registry:ui",
      "target": "components/plate-ui/separator.tsx"
    }
  ],
  "name": "separator",
  "registryDependencies": [],
  "type": "registry:ui",
  "$schema": "https://platejs.org/schema/registry-item.json",
  "author": "udecode (https://platejs.org)"
}