{
  "name": "authentication-03",
  "type": "registry:block",
  "registryDependencies": [
    "button",
    "card",
    "input",
    "label"
  ],
  "files": [
    {
      "path": "block/authentication-03.tsx",
      "content": "import Link from \"next/link\"\n\nimport { Button } from \"@/registry/default/ui/button\"\nimport {\n  Card,\n  CardContent,\n  CardDescription,\n  CardHeader,\n  CardTitle,\n} from \"@/registry/default/ui/card\"\nimport { Input } from \"@/registry/default/ui/input\"\nimport { Label } from \"@/registry/default/ui/label\"\n\nexport default function LoginForm() {\n  return (\n    <Card className=\"mx-auto max-w-sm\">\n      <CardHeader>\n        <CardTitle className=\"text-xl\">Sign Up</CardTitle>\n        <CardDescription>\n          Enter your information to create an account\n        </CardDescription>\n      </CardHeader>\n      <CardContent>\n        <div className=\"grid gap-4\">\n          <div className=\"grid grid-cols-2 gap-4\">\n            <div className=\"grid gap-2\">\n              <Label htmlFor=\"first-name\">First name</Label>\n              <Input id=\"first-name\" placeholder=\"Max\" required />\n            </div>\n            <div className=\"grid gap-2\">\n              <Label htmlFor=\"last-name\">Last name</Label>\n              <Input id=\"last-name\" placeholder=\"Robinson\" required />\n            </div>\n          </div>\n          <div className=\"grid gap-2\">\n            <Label htmlFor=\"email\">Email</Label>\n            <Input\n              id=\"email\"\n              type=\"email\"\n              placeholder=\"m@example.com\"\n              required\n            />\n          </div>\n          <div className=\"grid gap-2\">\n            <Label htmlFor=\"password\">Password</Label>\n            <Input id=\"password\" type=\"password\" />\n          </div>\n          <Button type=\"submit\" className=\"w-full\">\n            Create an account\n          </Button>\n          <Button variant=\"outline\" className=\"w-full\">\n            Sign up with GitHub\n          </Button>\n        </div>\n        <div className=\"mt-4 text-center text-sm\">\n          Already have an account?{\" \"}\n          <Link href=\"#\" className=\"underline\">\n            Sign in\n          </Link>\n        </div>\n      </CardContent>\n    </Card>\n  )\n}\n",
      "type": "registry:block",
      "target": ""
    }
  ]
}