{
  "files": [
    {
      "path": "hooks/use-debounce.ts",
      "content": "import * as React from 'react';\n\nexport const useDebounce = <T>(value: T, delay = 500) => {\n  const [debouncedValue, setDebouncedValue] = React.useState(value);\n\n  React.useEffect(() => {\n    const handler: NodeJS.Timeout = setTimeout(() => {\n      setDebouncedValue(value);\n    }, delay);\n\n    // Cancel the timeout if value changes (also on delay change or unmount)\n    return () => {\n      clearTimeout(handler);\n    };\n  }, [value, delay]);\n\n  return debouncedValue;\n};\n",
      "type": "registry:hook",
      "target": "hooks/use-debounce.ts"
    }
  ],
  "name": "use-debounce",
  "type": "registry:hook",
  "$schema": "https://platejs.org/schema/registry-item.json",
  "author": "udecode (https://platejs.org)"
}