{
  "categories": [
    "Editors"
  ],
  "files": [
    {
      "path": "blocks/editor-select/page.tsx",
      "content": "import EditorSelectForm from '@/registry/default/examples/select-editor-demo';\n\nexport default function Page() {\n  return (\n    <div className=\"flex h-screen w-full justify-center\" data-registry=\"plate\">\n      <EditorSelectForm />\n    </div>\n  );\n}\n",
      "type": "registry:page",
      "target": "app/editor/page.tsx"
    }
  ],
  "name": "editor-select",
  "registryDependencies": [
    "select-editor-demo"
  ],
  "type": "registry:block",
  "$schema": "https://platejs.org/schema/registry-item.json",
  "author": "udecode (https://platejs.org)"
}