{
  "dependencies": [
    "@radix-ui/react-avatar"
  ],
  "doc": {
    "description": "An image element with a fallback for representing the user.",
    "links": {
      "doc": "https://ui.shadcn.com/docs/components/avatar"
    }
  },
  "files": [
    {
      "path": "plate-ui/avatar.tsx",
      "content": "'use client';\n\nimport * as AvatarPrimitive from '@radix-ui/react-avatar';\nimport { withCn } from '@udecode/cn';\n\nexport const Avatar = withCn(\n  AvatarPrimitive.Root,\n  'relative flex size-10 shrink-0 overflow-hidden rounded-full'\n);\n\nexport const AvatarImage = withCn(\n  AvatarPrimitive.Image,\n  'aspect-square size-full'\n);\n\nexport const AvatarFallback = withCn(\n  AvatarPrimitive.Fallback,\n  'flex size-full items-center justify-center rounded-full bg-muted'\n);\n",
      "type": "registry:ui",
      "target": "components/plate-ui/avatar.tsx"
    }
  ],
  "name": "avatar",
  "registryDependencies": [],
  "type": "registry:ui",
  "$schema": "https://platejs.org/schema/registry-item.json",
  "author": "udecode (https://platejs.org)"
}