{
  "dependencies": [
    "@udecode/plate-toggle"
  ],
  "doc": {
    "description": "A toolbar button for expanding and collapsing blocks.",
    "docs": [
      {
        "route": "/docs/toggle"
      }
    ],
    "examples": [
      "toggle-demo"
    ]
  },
  "files": [
    {
      "path": "plate-ui/toggle-toolbar-button.tsx",
      "content": "'use client';\n\nimport React from 'react';\n\nimport { withRef } from '@udecode/cn';\nimport {\n  useToggleToolbarButton,\n  useToggleToolbarButtonState,\n} from '@udecode/plate-toggle/react';\nimport { ListCollapseIcon } from 'lucide-react';\n\nimport { ToolbarButton } from './toolbar';\n\nexport const ToggleToolbarButton = withRef<typeof ToolbarButton>(\n  (rest, ref) => {\n    const state = useToggleToolbarButtonState();\n    const { props } = useToggleToolbarButton(state);\n\n    return (\n      <ToolbarButton ref={ref} tooltip=\"Toggle\" {...props} {...rest}>\n        <ListCollapseIcon />\n      </ToolbarButton>\n    );\n  }\n);\n",
      "type": "registry:ui",
      "target": "components/plate-ui/toggle-toolbar-button.tsx"
    }
  ],
  "name": "toggle-toolbar-button",
  "registryDependencies": [
    "toolbar"
  ],
  "type": "registry:ui",
  "$schema": "https://platejs.org/schema/registry-item.json",
  "author": "udecode (https://platejs.org)"
}