{
  "dependencies": [
    "@udecode/plate-media",
    "sonner"
  ],
  "doc": {
    "description": "Show toast notifications for media uploads.",
    "docs": [
      {
        "route": "/docs/media"
      }
    ],
    "examples": [
      "media-demo",
      "upload-pro"
    ]
  },
  "files": [
    {
      "path": "plate-ui/media-upload-toast.tsx",
      "content": "'use client';\n\nimport { useEffect } from 'react';\n\nimport { PlaceholderPlugin, UploadErrorCode } from '@udecode/plate-media/react';\nimport { usePluginOption } from '@udecode/plate/react';\nimport { toast } from 'sonner';\n\nexport const useUploadErrorToast = () => {\n  const uploadError = usePluginOption(PlaceholderPlugin, 'error');\n\n  useEffect(() => {\n    if (!uploadError) return;\n\n    const { code, data } = uploadError;\n\n    switch (code) {\n      case UploadErrorCode.INVALID_FILE_SIZE: {\n        toast.error(\n          `The size of files ${data.files\n            .map((f) => f.name)\n            .join(', ')} is invalid`\n        );\n\n        break;\n      }\n      case UploadErrorCode.INVALID_FILE_TYPE: {\n        toast.error(\n          `The type of files ${data.files\n            .map((f) => f.name)\n            .join(', ')} is invalid`\n        );\n\n        break;\n      }\n      case UploadErrorCode.TOO_LARGE: {\n        toast.error(\n          `The size of files ${data.files\n            .map((f) => f.name)\n            .join(', ')} is too large than ${data.maxFileSize}`\n        );\n\n        break;\n      }\n      case UploadErrorCode.TOO_LESS_FILES: {\n        toast.error(\n          `The mini um number of files is ${data.minFileCount} for ${data.fileType}`\n        );\n\n        break;\n      }\n      case UploadErrorCode.TOO_MANY_FILES: {\n        toast.error(\n          `The maximum number of files is ${data.maxFileCount} ${\n            data.fileType ? `for ${data.fileType}` : ''\n          }`\n        );\n\n        break;\n      }\n    }\n  }, [uploadError]);\n};\n\nexport const MediaUploadToast = () => {\n  useUploadErrorToast();\n\n  return null;\n};\n",
      "type": "registry:ui",
      "target": "components/plate-ui/media-upload-toast.tsx"
    }
  ],
  "name": "media-upload-toast",
  "registryDependencies": [],
  "type": "registry:ui",
  "$schema": "https://platejs.org/schema/registry-item.json",
  "author": "udecode (https://platejs.org)"
}