{
  "dependencies": [
    "@udecode/plate-block-quote",
    "@udecode/plate-code-block",
    "@udecode/plate-heading",
    "@udecode/plate-indent",
    "@udecode/plate-indent-list",
    "@udecode/plate-toggle"
  ],
  "files": [
    {
      "path": "components/editor/plugins/indent-list-plugins.ts",
      "content": "'use client';\n\nimport { BlockquotePlugin } from '@udecode/plate-block-quote/react';\nimport { CodeBlockPlugin } from '@udecode/plate-code-block/react';\nimport { HEADING_LEVELS } from '@udecode/plate-heading';\nimport { IndentListPlugin } from '@udecode/plate-indent-list/react';\nimport { IndentPlugin } from '@udecode/plate-indent/react';\nimport { TogglePlugin } from '@udecode/plate-toggle/react';\nimport { ParagraphPlugin } from '@udecode/plate/react';\n\nimport {\n  FireLiComponent,\n  FireMarker,\n} from '@/components/plate-ui/indent-fire-marker';\nimport {\n  TodoLi,\n  TodoMarker,\n} from '@/components/plate-ui/indent-todo-marker';\n\nexport const indentListPlugins = [\n  IndentPlugin.extend({\n    inject: {\n      targetPlugins: [\n        ParagraphPlugin.key,\n        ...HEADING_LEVELS,\n        BlockquotePlugin.key,\n        CodeBlockPlugin.key,\n        TogglePlugin.key,\n      ],\n    },\n  }),\n  IndentListPlugin.extend({\n    inject: {\n      targetPlugins: [\n        ParagraphPlugin.key,\n        ...HEADING_LEVELS,\n        BlockquotePlugin.key,\n        CodeBlockPlugin.key,\n        TogglePlugin.key,\n      ],\n    },\n    options: {\n      listStyleTypes: {\n        fire: {\n          liComponent: FireLiComponent,\n          markerComponent: FireMarker,\n          type: 'fire',\n        },\n        todo: {\n          liComponent: TodoLi,\n          markerComponent: TodoMarker,\n          type: 'todo',\n        },\n      },\n    },\n  }),\n];\n",
      "type": "registry:component",
      "target": "components/editor/plugins/indent-list-plugins.ts"
    }
  ],
  "name": "indent-list-plugins",
  "registryDependencies": [
    "indent-fire-marker",
    "indent-todo-marker"
  ],
  "type": "registry:component",
  "$schema": "https://platejs.org/schema/registry-item.json",
  "author": "udecode (https://platejs.org)"
}