{
  "dependencies": [
    "@udecode/plate-selection"
  ],
  "doc": {
    "description": "A visual overlay for selected blocks.",
    "docs": [
      {
        "route": "/docs/block-selection"
      },
      {
        "route": "https://pro.platejs.org/docs/components/block-selection"
      }
    ],
    "examples": [
      "block-selection-demo",
      "block-selection-pro"
    ],
    "label": "New"
  },
  "files": [
    {
      "path": "plate-ui/block-selection.tsx",
      "content": "'use client';\n\nimport React from 'react';\n\nimport { cn } from '@udecode/cn';\nimport { DndPlugin } from '@udecode/plate-dnd';\nimport { useBlockSelected } from '@udecode/plate-selection/react';\nimport { usePluginOption } from '@udecode/plate/react';\nimport { type VariantProps, cva } from 'class-variance-authority';\n\nexport const blockSelectionVariants = cva(\n  'pointer-events-none absolute inset-0 z-1 bg-brand/[.13] transition-opacity',\n  {\n    defaultVariants: {\n      active: true,\n    },\n    variants: {\n      active: {\n        false: 'opacity-0',\n        true: 'opacity-100',\n      },\n    },\n  }\n);\n\nexport function BlockSelection({\n  className,\n  ...props\n}: React.HTMLAttributes<HTMLDivElement> &\n  VariantProps<typeof blockSelectionVariants>) {\n  const isBlockSelected = useBlockSelected();\n  const isDragging = usePluginOption(DndPlugin, 'isDragging');\n\n  if (!isBlockSelected) return null;\n\n  return (\n    <div\n      className={cn(\n        blockSelectionVariants({\n          active: isBlockSelected && !isDragging,\n        }),\n        className\n      )}\n      {...props}\n    />\n  );\n}\n",
      "type": "registry:ui",
      "target": "components/plate-ui/block-selection.tsx"
    }
  ],
  "name": "block-selection",
  "registryDependencies": [],
  "type": "registry:ui",
  "$schema": "https://platejs.org/schema/registry-item.json",
  "author": "udecode (https://platejs.org)"
}