{
  "doc": {
    "title": "Disabled"
  },
  "files": [
    {
      "path": "examples/editor-disabled.tsx",
      "content": "'use client';\n\nimport { Plate, usePlateEditor } from '@udecode/plate/react';\n\nimport { Editor, EditorContainer } from '@/components/plate-ui/editor';\n\nexport default function EditorDisabled() {\n  const editor = usePlateEditor();\n\n  return (\n    <Plate editor={editor}>\n      <EditorContainer>\n        <Editor disabled placeholder=\"Type your message here.\" />\n      </EditorContainer>\n    </Plate>\n  );\n}\n",
      "type": "registry:example",
      "target": "components/editor-disabled.tsx"
    }
  ],
  "name": "editor-disabled",
  "registryDependencies": [],
  "type": "registry:example",
  "$schema": "https://platejs.org/schema/registry-item.json",
  "author": "udecode (https://platejs.org)"
}