{
  "dependencies": [],
  "files": [
    {
      "path": "components/editor/plugins/fixed-toolbar-plugin.tsx",
      "content": "'use client';\n\nimport { createPlatePlugin } from '@udecode/plate/react';\n\nimport { FixedToolbar } from '@/components/plate-ui/fixed-toolbar';\nimport { FixedToolbarButtons } from '@/components/plate-ui/fixed-toolbar-buttons';\n\nexport const FixedToolbarPlugin = createPlatePlugin({\n  key: 'fixed-toolbar',\n  render: {\n    beforeEditable: () => (\n      <FixedToolbar>\n        <FixedToolbarButtons />\n      </FixedToolbar>\n    ),\n  },\n});\n",
      "type": "registry:component",
      "target": "components/editor/plugins/fixed-toolbar-plugin.tsx"
    }
  ],
  "name": "fixed-toolbar-plugin",
  "registryDependencies": [
    "fixed-toolbar",
    "fixed-toolbar-buttons"
  ],
  "type": "registry:component",
  "$schema": "https://platejs.org/schema/registry-item.json",
  "author": "udecode (https://platejs.org)"
}