{
  "name": "authentication-01",
  "type": "registry:block",
  "registryDependencies": [
    "button",
    "card",
    "input",
    "label"
  ],
  "files": [
    {
      "path": "block/authentication-01.tsx",
      "content": "import { Button } from \"@/registry/default/ui/button\"\nimport {\n  Card,\n  CardContent,\n  CardDescription,\n  CardFooter,\n  CardHeader,\n  CardTitle,\n} from \"@/registry/default/ui/card\"\nimport { Input } from \"@/registry/default/ui/input\"\nimport { Label } from \"@/registry/default/ui/label\"\n\nexport default function LoginForm() {\n  return (\n    <Card className=\"w-full max-w-sm\">\n      <CardHeader>\n        <CardTitle className=\"text-2xl\">Login</CardTitle>\n        <CardDescription>\n          Enter your email below to login to your account.\n        </CardDescription>\n      </CardHeader>\n      <CardContent className=\"grid gap-4\">\n        <div className=\"grid gap-2\">\n          <Label htmlFor=\"email\">Email</Label>\n          <Input id=\"email\" type=\"email\" placeholder=\"m@example.com\" required />\n        </div>\n        <div className=\"grid gap-2\">\n          <Label htmlFor=\"password\">Password</Label>\n          <Input id=\"password\" type=\"password\" required />\n        </div>\n      </CardContent>\n      <CardFooter>\n        <Button className=\"w-full\">Sign in</Button>\n      </CardFooter>\n    </Card>\n  )\n}\n",
      "type": "registry:block",
      "target": ""
    }
  ]
}