{
  "dependencies": [
    "@udecode/plate-comments"
  ],
  "files": [
    {
      "content": "'use client';\n\nimport type { TComment } from '@udecode/plate-comments';\n\nimport { CommentsPlugin } from '@udecode/plate-comments/react';\n\nimport { CommentsPopover } from '@/components/plate-ui/comments-popover';\n\nconst commentsData: Record<string, TComment> = {\n  1: {\n    id: '1',\n    createdAt: 1_663_453_625_129,\n    userId: '1',\n    value: [{ children: [{ text: 'This is a comment.' }], type: 'p' }],\n  },\n  2: {\n    id: '2',\n    createdAt: 1_663_453_729_191,\n    userId: '1',\n    value: [\n      { children: [{ text: 'Can you review this one @12joan?' }], type: 'p' },\n    ],\n  },\n  3: {\n    id: '3',\n    createdAt: 1_663_453_740_180,\n    isResolved: true,\n    userId: '1',\n    value: [{ children: [{ text: 'This is a resolved comment.' }], type: 'p' }],\n  },\n  4: {\n    id: '4',\n    createdAt: 1_663_453_740_181,\n    parentId: '2',\n    userId: '2',\n    value: [{ children: [{ text: 'LGTM.' }], type: 'p' }],\n  },\n  5: {\n    id: '4',\n    createdAt: 1_663_453_740_182,\n    parentId: '2',\n    userId: '1',\n    value: [{ children: [{ text: 'Thanks!' }], type: 'p' }],\n  },\n};\n\nexport const commentsPlugin = CommentsPlugin.configure({\n  options: {\n    comments: commentsData,\n    myUserId: '1',\n    users: {\n      1: {\n        id: '1',\n        avatarUrl: 'https://avatars.githubusercontent.com/u/19695832?s=96&v=4',\n        name: 'zbeyens',\n      },\n      2: {\n        id: '2',\n        avatarUrl: 'https://avatars.githubusercontent.com/u/4272090?v=4',\n        name: '12joan',\n      },\n    },\n  },\n  render: { afterEditable: () => <CommentsPopover /> },\n});\n",
      "path": "components/editor/plugins/comments-plugin.tsx",
      "target": "components/editor/plugins/comments-plugin.tsx",
      "type": "registry:component"
    }
  ],
  "name": "comments-plugin",
  "registryDependencies": [
    "comments-popover"
  ],
  "type": "registry:component"
}