{
  "files": [
    {
      "path": "examples/basic-editor-default-demo.tsx",
      "content": "'use client';\n\nimport React from 'react';\n\nimport { Plate, PlateContent, usePlateEditor } from '@udecode/plate/react';\n\nexport default function BasicEditorDefaultDemo() {\n  const editor = usePlateEditor();\n\n  return (\n    <Plate editor={editor}>\n      <PlateContent placeholder=\"Type...\" />\n    </Plate>\n  );\n}\n",
      "type": "registry:example",
      "target": "components/basic-editor-default-demo.tsx"
    }
  ],
  "name": "basic-editor-default-demo",
  "registryDependencies": [],
  "type": "registry:example",
  "$schema": "https://platejs.org/schema/registry-item.json",
  "author": "udecode (https://platejs.org)"
}